<?xml version="1.0" encoding="UTF-8"?>

<F4IIYA_Tancverseny xmlns:xs="http://www.w3.org/2001/XMLSchema-instance" xs:noNamespaceSchemaLocation="XMLSchemaF4IIYA.xsd">

    <!--Zenék-->

    <zene zene_id="1">
        <cim>Ébredj fel</cim>
        <hossz>3:45</hossz>
        <mufaj>Pop</mufaj>
        <eloado>Kovács Anna</eloado>
    </zene>

    <zene zene_id="2">
        <cim>Korallpart</cim>
        <hossz>4:20</hossz>
        <mufaj>Rock</mufaj>
        <eloado>Szabó Bence és a Hangok</eloado>
    </zene>

    <zene zene_id="3">
        <cim>Táncolj!</cim>
        <hossz>2:58</hossz>
        <mufaj>Elektronikus</mufaj>
        <eloado>Electro Vibes</eloado>
    </zene>

    <zene zene_id="4">
        <cim>Szerelmi történet</cim>
        <hossz>5:12</hossz>
        <mufaj>Romantikus</mufaj>
        <eloado>Nagy Eszter és a Szívhangok</eloado>
    </zene>

    <zene zene_id="5">
        <cim>Éjszakai láz</cim>
        <hossz>3:30</hossz>
        <mufaj>Disco</mufaj>
        <eloado>DiscoFever Band</eloado>
    </zene>
    
    <!--Versenyhelyszínek-->

    <versenyhelyszin verseny_id="1">
        <nev>Park Stadion</nev>
        <terulet>800 négyzetméter</terulet>
        <befogadokepesseg>5000</befogadokepesseg>
        <cim>
            <iranyitoszam>1024</iranyitoszam>
            <varos>Budapest</varos>
            <utca_hazszam>Kossuth utca 10</utca_hazszam>
        </cim>
    </versenyhelyszin>

    <versenyhelyszin verseny_id="2">
        <nev>Sportaréna</nev>
        <terulet>1200 négyzetméter</terulet>
        <befogadokepesseg>10000</befogadokepesseg>
        <cim>
            <iranyitoszam>1132</iranyitoszam>
            <varos>Budapest</varos>
            <utca_hazszam>Rákospatak utca 5</utca_hazszam>
        </cim>
    </versenyhelyszin>

    <versenyhelyszin verseny_id="3">
        <nev>Sportközpont</nev>
        <terulet>600 négyzetméter</terulet>
        <befogadokepesseg>3000</befogadokepesseg>
        <cim>
            <iranyitoszam>3521</iranyitoszam>
            <varos>Debrecen</varos>
            <utca_hazszam>Sport utca 8</utca_hazszam>
        </cim>
    </versenyhelyszin>

    <versenyhelyszin verseny_id="4">
        <nev>Városi Stadion</nev>
        <terulet>1000 négyzetméter</terulet>
        <befogadokepesseg>7000</befogadokepesseg>
        <cim>
            <iranyitoszam>4023</iranyitoszam>
            <varos>Debrecen</varos>
            <utca_hazszam>Sport tér 15</utca_hazszam>
        </cim>
    </versenyhelyszin>

    <versenyhelyszin verseny_id="5">
        <nev>Park Stadion</nev>
        <terulet>850 négyzetméter</terulet>
        <befogadokepesseg>5500</befogadokepesseg>
        <cim>
            <iranyitoszam>1015</iranyitoszam>
            <varos>Budapest</varos>
            <utca_hazszam>Sport út 20</utca_hazszam>
        </cim>
    </versenyhelyszin>

    <!--Táncok-->

    <tanc tanc_id="1">
        <t_mufaj>Modern tánc</t_mufaj>
        <nev>Fények játéka</nev>
        <hossz>4:30</hossz>
    </tanc>

    <tanc tanc_id="2">
        <t_mufaj>Latin tánc</t_mufaj>
        <nev>Forró ritmusok</nev>
        <hossz>3:15</hossz>
    </tanc>

    <tanc tanc_id="3">
        <t_mufaj>Balett</t_mufaj>
        <nev>Hamupipőke álom</nev>
        <hossz>5:00</hossz>
    </tanc>

    <tanc tanc_id="4">
        <t_mufaj>Jazz tánc</t_mufaj>
        <nev>Éjszakai szimfónia</nev>
        <hossz>3:45</hossz>
    </tanc>

    <tanc tanc_id="5">
        <t_mufaj>Flamenco</t_mufaj>
        <nev>Tűz és szenvedély</nev>
        <hossz>4:20</hossz>
    </tanc>    

    <!--Csoportok-->

    <csoport csoport_id="1" produkcio="1">
        <tagok_szama>15</tagok_szama>
        <nev>Arany Csillagok</nev>
        <egyesulet>Táncművészeti Egyesület</egyesulet>
        <korcsoport>25-30</korcsoport>
    </csoport>

    <csoport csoport_id="2" produkcio="2">
        <tagok_szama>10</tagok_szama>
        <nev>Kis Angyalok</nev>
        <egyesulet>Balett Stúdió</egyesulet>
        <korcsoport>12-18</korcsoport>
        <korcsoport>12-14</korcsoport>
    </csoport>

    <csoport csoport_id="3" produkcio="3">
        <tagok_szama>20</tagok_szama>
        <nev>Latin Ritmusok</nev>
        <egyesulet>Tánciskola</egyesulet>
        <korcsoport>25-30</korcsoport>
    </csoport>

    <csoport csoport_id="4" produkcio="4">
        <tagok_szama>12</tagok_szama>
        <nev>Jazz Express</nev>
        <egyesulet>Művészeti Társulat</egyesulet>
        <korcsoport>18-22</korcsoport>
    </csoport>

    <csoport csoport_id="5" produkcio="5">
        <tagok_szama>18</tagok_szama>
        <nev>Flamenco Szenvedély</nev>
        <egyesulet>Táncműhely</egyesulet>
        <korcsoport>25-30</korcsoport>
    </csoport>    

    <!--Versenyzők-->

    <versenyzo versenyzo_id="1" tag="1">
        <eletkor>25</eletkor>
        <nev>Kovács Anna</nev>
        <szuletesi_datum>1998-04-10</szuletesi_datum>
        <lakcim>
            <iranyitoszam>1024</iranyitoszam>
            <varos>Budapest</varos>
            <utca_hazszam>Kossuth utca 10</utca_hazszam>
        </lakcim>
    </versenyzo>

    <versenyzo versenyzo_id="2" tag="3">
        <eletkor>30</eletkor>
        <nev>Szabó Bence</nev>
        <szuletesi_datum>1992-08-22</szuletesi_datum>
        <lakcim>
            <iranyitoszam>1132</iranyitoszam>
            <varos>Budapest</varos>
            <utca_hazszam>Rákospatak utca 5</utca_hazszam>
        </lakcim>
    </versenyzo>

    <versenyzo versenyzo_id="3" tag="4">
        <eletkor>22</eletkor>
        <nev>Molnár Rita</nev>
        <szuletesi_datum>2001-05-28</szuletesi_datum>
        <lakcim>
            <iranyitoszam>3521</iranyitoszam>
            <varos>Debrecen</varos>
            <utca_hazszam>Sport utca 8</utca_hazszam>
        </lakcim>
    </versenyzo>

    <versenyzo versenyzo_id="4" tag="1">
        <eletkor>28</eletkor>
        <nev>Nagy Ferenc</nev>
        <szuletesi_datum>1995-11-15</szuletesi_datum>
        <lakcim>
            <iranyitoszam>4023</iranyitoszam>
            <varos>Debrecen</varos>
            <utca_hazszam>Sport tér 15</utca_hazszam>
        </lakcim>
    </versenyzo>

    <versenyzo versenyzo_id="5" tag="4">
        <eletkor>19</eletkor>
        <nev>Kiss Mária</nev>
        <szuletesi_datum>2004-07-03</szuletesi_datum>
        <lakcim>
            <iranyitoszam>1015</iranyitoszam>
            <varos>Budapest</varos>
            <utca_hazszam>Sport út 20</utca_hazszam>
        </lakcim>
    </versenyzo>

    <versenyzo versenyzo_id="6" tag="2">
        <eletkor>14</eletkor>
        <nev>Nagy Éva</nev>
        <szuletesi_datum>2009-09-05</szuletesi_datum>
        <lakcim>
            <iranyitoszam>4400</iranyitoszam>
            <varos>Nyíregyháza</varos>
            <utca_hazszam>Kossuth tér 5</utca_hazszam>
        </lakcim>
    </versenyzo>
    
    <versenyzo versenyzo_id="7" tag="3">
        <eletkor>26</eletkor>
        <nev>Kovács Péter</nev>
        <szuletesi_datum>1997-12-18</szuletesi_datum>
        <lakcim>
            <iranyitoszam>3525</iranyitoszam>
            <varos>Debrecen</varos>
            <utca_hazszam>Kisfaludy utca 12</utca_hazszam>
        </lakcim>
    </versenyzo>

    <versenyzo versenyzo_id="8" tag="3">
        <eletkor>29</eletkor>
        <nev>Szabó József</nev>
        <szuletesi_datum>1993-06-30</szuletesi_datum>
        <lakcim>
            <iranyitoszam>1139</iranyitoszam>
            <varos>Budapest</varos>
            <utca_hazszam>Kiss János utca 8</utca_hazszam>
        </lakcim>
    </versenyzo>

    <versenyzo versenyzo_id="9" tag="2">
        <nev>Szűcs László</nev>
        <szuletesi_datum>2010-02-14</szuletesi_datum>
        <lakcim>
            <iranyitoszam>4405</iranyitoszam>
            <varos>Nyíregyháza</varos>
            <utca_hazszam>Petőfi tér 3</utca_hazszam>
        </lakcim>
    </versenyzo>

    <versenyzo versenyzo_id="10" tag="2">
        <nev>Balogh Judit</nev>
        <szuletesi_datum>2008-11-10</szuletesi_datum>
        <lakcim>
            <iranyitoszam>3522</iranyitoszam>
            <varos>Debrecen</varos>
            <utca_hazszam>Bajnai út 7</utca_hazszam>
        </lakcim>
    </versenyzo>    

    <!--A tánc helye több-több kapcsolat-->

    <tanc_helye th_id="1" tanc_id="1" verseny_id="1">
        <pontszam>78</pontszam>
    </tanc_helye>

    <tanc_helye th_id="2" tanc_id="2" verseny_id="1">
        <pontszam>86</pontszam>
    </tanc_helye>

    <tanc_helye th_id="3" tanc_id="3" verseny_id="5">
        <pontszam>58</pontszam>
    </tanc_helye>

    <tanc_helye th_id="4" tanc_id="4" verseny_id="3">
        <pontszam>37</pontszam>
    </tanc_helye>

    <tanc_helye th_id="5" tanc_id="5" verseny_id="2">
        <pontszam>64</pontszam>
    </tanc_helye>

    <tanc_helye th_id="6" tanc_id="1" verseny_id="4">
        <pontszam>75</pontszam>
    </tanc_helye>

    <tanc_helye th_id="7" tanc_id="3" verseny_id="1">
        <pontszam>46</pontszam>
    </tanc_helye>

    <tanc_helye th_id="8" tanc_id="5" verseny_id="3">
        <pontszam>86</pontszam>
    </tanc_helye>

    <tanc_helye th_id="9" tanc_id="2" verseny_id="2">
        <pontszam>57</pontszam>
    </tanc_helye>

    <tanc_helye th_id="10" tanc_id="4" verseny_id="1">
        <pontszam>87</pontszam>
    </tanc_helye>

    <!--Lejátszott zene több-több kapcsolat-->

    <lejatszott_zene tanc_id="1" zene_id="4"/>
    <lejatszott_zene tanc_id="2" zene_id="3"/>
    <lejatszott_zene tanc_id="4" zene_id="2"/>
    <lejatszott_zene tanc_id="5" zene_id="5"/>
    <lejatszott_zene tanc_id="3" zene_id="1"/>

</F4IIYA_Tancverseny>